,이름,아이디,리뷰,날짜,별점
0,카페 마마스 역삼점,로보트,무료주차가 삼십분 밖에 안되지만 주말에는 따로 주차비 채크 안하는 것 같습니다. 브런치삼아 먹기 좋아요,2020년 8월 30일,4
1,카페 마마스 역삼점,숑숑,마마스 특유의 리코타치즈샐러드와 파니니 맛은 좋아요 청포도케일쥬스가 맛이 좋네용 ㅋㅋ 마마스체인점과 맛은 동일합니다~~,2019년 5월 17일,4
2,카페 마마스 역삼점,가성비와친절,9시30분 전에 가면 6천원이내로 저렴하게 즐길 수 있어서 자주 이용하는 편이다,2018년 1월 8일,4
3,카페 마마스 역삼점,Ddnc,"리코타치즈샐러드는 언제나 맛있음
터키 샌드위치도 음료도 굳",2020년 8월 1일,4
4,카페 마마스 역삼점,Sungeun Rhee,"다양한 샐러드 메뉴가 많아서 좋고 깔끔, 싱싱하고 맛있어서 즐겨 찾아요",2월 16일,4
5,카페 마마스 역삼점,Laura,처음엔 워낙 밖에서 사먹는 샐러드 가격들이 비싸고 양이 적어서 여기도 그럴 줄 알았는데 양 엄청나요! 특히 닭가슴살 진짜 큰 거 통째로 넣어주시는 거 같아서 혼자 다 못 먹었어요ㅠㅠ 그리고 파니니는 정말 치즈가 살살 녹아서 너무 맛있었어요ㅠㅠ 이것도 양이 많아서 나중에 포장하긴 했는데 카페마마스 다 양도 많고 맛도 괜찮아요!,2018년 1월 21일,4
6,카페 마마스 역삼점,coloursky,,2017년 9월 18일,3
7,카페 마마스 역삼점,Hyeji Lee,맛있습니다 연어 샌드위치도 맛있고 그냥 다 맛있음,2017년 6월 13일,4
